
하늘공원,4.5," 7,528",공원,서울특별시 마포구 상암동 487-48,높이 자란 무성한 풀을 따라 난 길을 걸어가면 탁 트인 전망을 자랑하는 언덕이 나오는 아름다운 지역입니다.,0
비자림,4.5," 3,589",수목원,제주특별자치도 제주시 구좌읍 비자숲길 55,500~800년된 비자나무 수천 그루가 자생하는 천연기념물입니다.,1
청계천,4.3," 3,738",관광 명소,서울특별시 종로구 청계천로 1,"산책로, 다리, 녹지가 있는 휴식 공간으로 개울 주변으로 복원공사가 이루어졌습니다.",4
망원한강공원,4.4," 3,767",공원,서울특별시 마포구 망원1동 마포나루길 467,성산대교와 양화대교 사이 한강 북단에 만들어진 망원지구는 아름다운 전망과 역사유적이 많은 곳입니다.,0
붉은오름 사려니숲길,4.6," 5,427",하이킹코스,제주특별자치도 서귀포시 표선면 가시리 산158-4,비자림로를 시작으로 물찻오름과 사려니 오름을 거쳐가는 삼나무가 우거진 숲길입니다.,3
선유도공원,4.5," 3,583",공원,서울특별시 영등포구 선유로 343,2002년 4월 다양한 볼거리와 즐거움을 선사하는 친환경생태공원으로 재생되었습니다.,0
문경새재오픈세트장,4.1," 3,371",관광 명소,경상북도 문경시 새재로 932,국내 최초의 야외사극촬영장인 문경새재오픈세트장에서 촬영된 모든 드라마와 영상물을 한눈에 볼 수 있게 촬영장 내 강녕전에 설치되어 운영중입니다.,4
한라산국립공원,4.7," 2,438",국립공원,제주특별자치도 제주시 1100로 2070-61,큰 산이 있는 국립공원으로 다양한 고산 식물과 하이킹 코스가 있으며 탁 트인 전망을 자랑합니다.,0
땅끝전망대,4.1," 2,912",전망대,전라남도 해남군 송지면 송호리,한반도의 가장 남쪽 땅끝에 위치한 최남단 전망대입니다.,2
북한산국립공원,4.6," 1,591",국립공원,서울특별시 성북구 보국문로 262,"산책로가 십자 모양으로 가로지르는 산악 공원으로, 오래된 절과 요새를 다양하게 찾아볼 수 있습니다.",0
경의선숲길,4.4," 2,103",공원,서울특별시 마포구 동교동 147-89,"녹음이 우거진 공원으로 탈바꿈한 옛 철로로 산책로, 잔디밭, 시내가 있으며 인근에는 카페가 있습니다.",0
몽마르뜨공원,4.4," 1,116",공원,서울특별시 서초구 서초동,불어로 작은이란 뜻의 쁘띠 프랑스란 말이 잘 어울리는 곳입니다.,0
해운대해수욕장,4.5," 1,114",해변,부산광역시,"이 1.5km 길이의 해변에서는 낚시, 수영, 다양한 축제, 스카이라인 전망을 즐길 수 있습니다.",3
홍대앞예술시장프리마켓,4.1," 1,171",시장,서울특별시 마포구 와우산로21길 19-3,독립 예술가들이 가판대에서 수공예품과 예술작품을 판매하는 비상설 야외 시장으로 이벤트도 열립니다.,2
주산지,4.2," 1,801",관광 명소,경상북도 청송군 부동면 주산지길 163,주왕산 국립공원의 100여년 된 저수지에는 물에 잠긴 왕버들 30여 그루가 신비로운 풍경을 자아냅니다,4
N서울타워,4.5," 45,826",타워,서울특별시 용산구 남산공원길 105,1980년에 문을 연 이 상징적인 타워는 도심의 탁 트인 전망을 자랑하며 회전식 레스토랑을 이용할 수 있습니다.,3
