
장소,평균평점,리뷰개수,구분,주소,설명,cluster
양재시민의숲,4.4," 2,213",공원,서울특별시 서초구 양재2동 236,"산책로, 기념물, 테니스장, 농구장, 배구장이 있으며 큰 나무가 가득한 공원입니다.",0
한강대교,4.5," 1,368",다리,서울특별시 이촌1동,석양을 감상하며 산책을 하거나 밤이 되면 조명으로 반짝이는 서울의 스카이라인이 보이는 다리입니다.,0
서울월드컵경기장,4.3," 6,328",경기장,서울특별시 마포구 성산2동 월드컵로 240,인기 있는 축구장이 자리한 유명한 경기장으로 쇼핑몰과 영화관을 갖추고 있습니다.,4
노을공원,4.6," 1,439",공원,서울특별시 마포구 상암동 486-6,가양대교와 양화대교 주변의 한강 올림픽대로 난지한강공원의 캠프장이 어우러진 풍경을 사계절 내내 감상할 수 있는 명소입니다,0
보신각,4.2," 2,138",역사적 장소,서울특별시 종로구 관철동 종로 54,시간을 알리는 데 사용된 1300년대 종각으로 정교한 외관이 특징이며 오늘날 매일 타종 행사를 진행합니다.,2
남한산성 북문,4.4," 1,818",역사적 명소,경기도 광주시 중부면 산성리 661,유서 깊은 군사 도시에 넓게 걸쳐 있는 남한산성의 아치형 석문입니다.,3
국립중앙박물관,4.6," 16,569",박물관,서울특별시 용산구 서빙고동 서빙고로 137,"2005년에 문을 연 대규모 건물로, 한국의 문화 및 군사적 유물과 예술 작품이 소장되어 있습니다.",1
북악팔각정,4.3," 8,042",관광 명소,서울특별시 종로구 평창동 북악산로 267,산 정상에 있어 서울의 풍경이 한눈에 들어오고 야생화 정원과 둘레길이 있는 다채로운 색상의 팔각정입니다.,4
서울숲공원,4.6," 7,780",공원,서울특별시 성동구 성수동1가 뚝섬로 273,"나무가 많고 자전거 도로가 있는 넓은 공원으로 장미, 호수, 나비 정원이 있고 사슴에게 먹이를 줄 수 있습니다.",0
행주산성,4.3," 3,233",역사적 장소,경기도 고양시 덕양구 행주동 행주로15번길 89,"기념비와 누각 사이로 산책로가 나 있는 수백 년 된 요새로, 무기가 전시되어 있고 언덕 아래 전망이 멋집니다.",3
전쟁기념관,4.6," 13,977",전쟁 박물관,서울특별시 용산구 남영동 이태원로 29,"한국의 전쟁을 다루는 박물관으로, 전시회장과 기념비, 야외 전차 전시가 마련되어 있습니다.",3
광화문광장,4.3," 8,941",역사적 명소,서울특별시 종로구 세종로 세종대로 172,서울시 친환경 재개발의 일환으로 2009년에 문을 연 대형 공공 광장입니다.,3
창의문,4.4," 1,082",역사적 명소,서울특별시 종로구 청운동,14세기에 건립된 성벽의 웅장한 석조 문으로 18세기에 목조 정문이 재건되었습니다.,3
서대문자연사박물관,4.3," 2,247",자연사 박물관,서울특별시 서대문구 연희동 연희로32길 51,"공룡의 뼈, 나비, 화석 전시실이 있는 현대 자연사 박물관입니다.",3
남산공원,4.6," 1,289",공원,서울특별시 중구 용산2가동 삼일대로 231,서울에서 가장 큰 공원으로 조용하고 나무가 울창한 언덕에 산책로가 있으며 전망대와 케이블카도 이용할 수 있습니다.,0
국립민속박물관,4.5," 1,599",박물관,서울특별시 종로구 세종로 삼청로 37,"1946년에 설립된 국립 박물관으로 한국인의 역사, 문화, 삶을 기념합니다.",1
대림미술관,4.2," 2,091",미술관,서울특별시 종로구 통의동 35-1 대림미술관,현대적으로 재개발한 공간에 자리한 현대 사진 및 디자인 미술관으로 카페가 있고 가이드 투어가 제공됩니다.,4
문화비축기지,4.2," 1,945",공원,서울특별시 마포구 성산동 증산로 87,더 이상 사용되지 않는 기름 탱크를 전시관과 공연장으로 탈바꿈한 공간이며 잘 조경된 정원이 있습니다.,4
인천 차이나타운,3.9," 9,340",관광 명소,인천광역시 중구 북성동,중국인 소유의 레스토랑과 기업으로 유명한 번화한 관광 및 문화 지구입니다.,5
남대문시장,4.2," 21,854",시장,서울특별시 중구 회현동 남대문시장4길 21,"1964년에 문을 연 이 넓은 노점상 지역에서는 옷, 생활용품, 지역 생산품이 판매됩니다.",2
감천문화마을,4.3," 20,337",관광 명소,부산광역시 사하구 감천2동 감내1로 200,"다채로운 주택, 벽화, 상점, 카페 등이 있는 그림 같은 명소입니다.",4
광장시장,4.1," 29,165",재래시장,서울특별시 종로구 종로4가 창경궁로 88,"다양한 전통 식료품, 의상, 기념품을 판매하는 유서 깊은 실내 시장입니다.",2
창경궁,4.6," 2,701",고궁,서울특별시 종로구 와룡동 창경궁로 185,"네 곳의 한국 전통 궁궐, 사당, 정원으로 이루어진 단지로, 가이드 투어와 자유 관람을 즐길 수 있습니다.",0
여의도공원,4.4," 5,004",공원,서울특별시 영등포구 여의동 여의공원로 68,"1971년에 개장했으며 벚나무, 아름다운 연못, 산책로가 있는 공원입니다.",0
충무아트센터,4.3," 2,435",아트 센터,서울특별시 중구 흥인동 퇴계로,서울시 중구문화재단이 운영·관리하는 복합문화예술공간입니다.,3
석촌호수 공원,4.5," 4,383",공원,서울특별시 송파구 잠실동 47,"넓고 아름다운 호수가 있는 유명 공원으로 이벤트 공간, 조깅 코스, 테마파크가 있습니다.",0
탑골공원,3.7," 2,910",공원,서울특별시 종로구 종로2가 종로 99,국보로 보호되는 10층 석탑이 자리한 아름다운 공원으로 전통적인 양식의 팔각정이 있습니다.,5
장항스카이워크,4.2," 2,119",관광 명소,충청남도 서천군 장항읍 장항산단로34번길 74-45, 장항송림산림욕장에 세워진 전망대로 천연 해솔숲 사이로 탁 트인 장항 앞바다가 보이는 환상적인 조망을 할 수 있습니다.,4
용인자연 휴양림,4.4," 2,010",휴양림,경기도 용인시 처인구 모현면 초부로 220,수려한 자연경관에 숙박시설과 산책로 어린이놀이터 등을 갖춘 체류형 휴식처이며 산책 코스를 갖춘 등산로도 있습니다.,3
자만벽화마을,3.9," 1,284",관광 명소,전라북도 전주시 풍남동 한옥레일바이크,언덕 위 집과 좁은 골목길에 다양한 만화 스타일의 벽화가 그려진 마을입니다.,5
용연구름다리,4.1," 1,677",관광 명소,제주특별자치도 제주시 용담이동,나무가 우거진 절벽의 깊은 만에 있는 상징적인 다리로 정자가 보이는 야경으로 유명합니다.,4
성산일출봉,4.6," 1,019",산봉우리,서귀포시 성산읍,화산 분화로 형성된 이 독특한 분화구 형태의 봉우리는 고대의 성과 비슷하다고 합니다.,1
제주조천 스위스마을,3.5," 1,509",관광 명소,제주특별자치도 제주시 조천읍 함와로 566-27,제주도의 아름다움과 스위스의 이국적인 정취를 담은 휴양지입니다.,5
제주불빛정원,4.0," 1,236",테마파크,제주특별자치도 제주시 애월읍 평화로,일몰부터 자정까지 밤의 정취를 만끽하는 제주시의 대표적인 야간 명소이며 화려한 불빛과 음악과 분위기 있는 포토존이 어우러져 늦은 밤까지 시간을 보내기 좋습니다.,2
수종사,4.5," 1,397",불교사찰,경기도 남양주시 조안면 북한강로433번길 186,경기도 남양주시에 있는 대한불교조계종 소속의 사찰입니다.,1
배곧생명공원,4.5," 2,056",공원,경기도 시흥시 배곧 2 로 25,배곧마루라는 작은 언덕과 스카이데크 갈대 산책로와 공연장 등이 있어 가족끼리 가기에 좋은 곳입니다.,0
덕진공원,4.1," 3,217",공원,전라북도 전주시 덕진구 덕진동1가 권삼득로 390,호수의 연꽃과 나무다리를 건너면 만날 수 있는 화려한 탑으로 잘 알려진 고요한 정원입니다.,4
이화동 벽화마을,4.1," 4,031",관광 명소,서울특별시 종로구 이화동 낙산4길 49,"색색의 벽화, 모자이크 타일로 된 계단, 철제 조형물이 늘어선 골목길입니다.",4
벽골제,4.2," 1,250",관광 명소,전라북도 김제시 부량면 신용리 119-1 KR, 우리나라 최초의 저수지라는데 의미가 있을 뿐 아니라 당시에 이미 이러한 저수지 축조가 가능할 정도의 고도로 발달된 토목기술을 보유하고 있었음을 입증해 준다는 점에서 우리나라 과학기술사에서도 획기적인 사실을 제공해 주는 유적입니다.,4
도라전망대,4.4," 2,867",관측소,경기도 파주시 장단면 제3땅굴로 310,비무장 지대와 북한이 내려다 보이며 망원경이 비치된 언덕 위의 관측소입니다.,0
영종대교기념관,4.0," 1,947",관광 명소,인천광역시 서구 경서동 산257-4,인천국제공항고속도로에 관련된 정보들을 한눈에 볼 수 있는 곳입니다.,5
양화한강공원,4.4," 1,851",공원,서울특별시 영등포구 당산2동 노들로 221,한강 전망이 아름답고 자전거 도로를 따라 장미가 피어 있는 좁은 잔디 공원입니다.,0
파리공원,4.2," 1,637",공원,서울특별시 양천구 목5동 906,서울 광장은 삼태극무늬로 꾸미고 파리 광장에는 프랑스식 화단을 조성하는 등 양국의 전통 양식을 조화롭게 반영했으며 야외 무대 광장에서는 인근 주민들읠 위한 공연히 펼쳐지며 야외 결혼식도 열립니다.,4
낙성대공원,4.4," 2,222",공원,서울특별시 관악구 봉천동 낙성대로 77,"강감찬 장군의 탄생지로 경치 좋은 공원으로 조성되어 있으며, 강감찬 장군을 기리는 사당과 동상이 있습니다.",0
제주동문시장,4.0," 25,508",재래시장,제주특별자치도 제주시 이도일동 관덕로14길 20,"싱싱한 농수산물, 의류, 잡화 등을 판매하는 역사가 오래된 실내 시장입니다.",2
통인시장,3.8," 6,088",재래시장,서울특별시 종로구 통인동 자하문로15길 18,"한국 전통 음식을 맛볼 수 있는 간이식당과 가판대, 식품 매장이 있는 재래시장입니다.",2
국립고궁박물관,4.5," 4,731",국립박물관,서울특별시 종로구 청운동 효자로 12,조선 왕조와 왕실을 다룬 전시와 다양한 유물을 볼 수 있으며 오디오 투어를 제공합니다.,0
헤이리 예술마을,3.9," 6,962",문화센터,경기도 파주시 탄현면 헤이리마을길 82-105,"화가, 조각가, 영화 제작자, 도예가 등 380여 명의 예술가가 모인 예술 공동체입니다.",5
장항스카이워크,4.2," 2,119",관광 명소,충청남도 서천군 장항읍 장항산단로34번길 74-45, 장항송림산림욕장에 세워진 전망대로 천연 해솔숲 사이로 탁 트인 장항 앞바다가 보이는 환상적인 조망을 할 수 있습니다.,4
대전스카이로드,4.1," 2,253",관광 명소,대전광역시 중구 은행선화동 중앙로164번길,국내 최초로 설계된 도심속 대형 LED 영상스크린을 통하여 다양한 예술작품과 첨단기술의 향연을 즐길 수 있습니다.,4
새연교,4.3," 1,929",다리,제주특별자치도 서귀포시 서귀동 남성중로 40,돛 모양의 타워를 통과하며 야간에 조명이 켜지는 보행자 전용 사장교입니다.,4
진도타워,4.3," 2,638",관광 명소,전라남도 진도군 군내면 만금길 112-41,416년 전 이순신 장군을 도와 명량대첩을 승리로 이끈 우리 조상과 진도군민들의 훌륭한 호국정신을 계승시키고자 만든 상징물입니다.,4
백제문화단지,4.3," 2,742",관광 명소,충청남도 부여군 규암면 백제문로 455,"백제 시대 생활을 보여주는 역사 공원으로 성, 탑, 절이 재건되어 있습니다.",4
정선아리랑시장,4.0," 4,070",재래시장,강원도 정선군 정선읍 봉양리 349-20,정선아리랑열차를 통해 널리 알려지면서 많은 관광객들이 찾고 있으며 농산물과 다양한 음식물을 판매하고 있습니다.,2
여의도공원,4.4," 5,004",공원,서울특별시 영등포구 여의동 여의공원로 68,"1971년에 개장했으며 벚나무, 아름다운 연못, 산책로가 있는 공원입니다.",0
화담숲,4.5," 11,385",수목원,경기도 광주시 도척면 도척윗로 278,고즈넉한 오솔길을 따라 걸으며 숲에 둘러싸인 정원에서 봄꽃과 가을 단풍을 느낄 수 있는 수목원입니다.,1
송월동 동화마을,3.9," 7,326",관광 명소,인천광역시 중구 송월동3가 자유공원서로45번길,이 마을의 집 대다수는 동화 속 이야기를 밝은 색상으로 그린 그림으로 꾸며져 있습니다.,5
프로방스 마을,3.9," 6,790",관광 명소,경기도 파주시 탄현면 새오리로 69,"남프랑스 테마의 마을로 유럽 스타일의 상점, 제과점, 레스토랑, 벽화가 있습니다.",5
남산골 한옥마을,4.3," 7,928",관광 명소,서울특별시 중구 필동 퇴계로34길 28,1392~1910년에 지은 한옥 5채를 복원하여 재탄생한 한옥 마을로 투어 및 문화 프로그램이 진행됩니다.,4
섭지코지,4.4," 12,459",관광 명소,제주특별자치도 서귀포시 성산읍 섭지코지로,"등대, 레스토랑, 상점, 경치 좋은 전망, 산책로를 갖추고 있는 조용한 해변 지역입니다.",0
서울로7017,4.1," 6,212",시티 공원,서울특별시 중구 봉래동2가 122-14,1970년대부터 사용되던 고가도로를 보수하여 2017년 공원으로 개장한 곳으로 길이는 약 1km입니다.,2
만장굴,4.2," 9,536",동굴,제주특별자치도 제주시 구좌읍 만장굴길 182,종유석과 석순이 있고 박쥐와 곤충이 서식하는 독특한 구조물의 긴 용암 동굴입니다.,4
청계 광장,4.4," 7,665",대광장,서울특별시 종로구 서린동 148,청계천 초입에 자리한 넓은 광장으로 붉은색과 푸른색의 띠가 회오리치는 고깔 모양 조각 작품과 폭포가 있습니다.,0
경암동철길마을 시작점,3.8," 6,160",관광 명소,전라북도 군산시 경촌안3길 49 KR,폐철로 옆에 조성된 고풍스러운 지역으로 사탕과 기념품을 판매하는 복고풍 상점과 거리 벽화가 있습니다.,5
시흥갯골생태공원,4.4," 5,594",생태 공원,경기도 시흥시 연성동 동서로 287,"강변과 꽃밭, 오래된 염전, 나선형 전망대가 있는 습지 보호구역입니다.",1
광명동굴,4.3," 10,452",관광 명소,경기도 광명시 학온동 가학로85번길 142,"엔터테인먼트 명소로 탈바꿈한 옛 광산 동굴로 조명 쇼, 수족관, 와이너리가 있습니다.",4
송도구름산책로,4.4," 5,283",관광 명소,부산광역시 서구 암남동 129-4,"송도해수욕장에 있는 구불구불한 산책로로, 등대가 보이고 머리 위로 케이블카가 지나다닙니다.",0
서귀포매일올레시장,4.0," 21,686",시장,제주특별자치도 서귀포시 서귀동 중앙로62번길 18,"1960년대에 설립된 실내 시장으로 농수산물, 가정용품 등을 판매하는 가판대가 많이 있습니다.",2
여의도한강공원,4.5," 12,825",공원,서울특별시 영등포구 여의도동 여의동로 330,"강가에 위치한 대형 공원으로 아름다운 경치와 조깅 코스, 수영장 등이 있어 많은 사람들의 사랑을 받고 있습니다.",0
답다니탑망대,4.1," 1,010",관광 명소,제주특별자치도 제주시 우도면 연평리,4.3 사건 당시에 제주도 본섬과 바다의 상황들을 알아보고자 쌓아 올린 초소의 역할을 한 돌탑입니다.,4
사라봉공원,4.5," 1,043",관광 명소,제주특별자치도 제주시 건입동 사라봉동길 74,제주시 동문로터리에서 동쪽으로 2km 거리에 있는 143m 높이의 낮은 동산입니다.,0
도두 무지개 해안도로,4.4," 1,856",관광 명소,제주특별자치도 제주시 도두일동 2287,파란 제주 하늘과 그 아래로 끝없이 펼쳐진 수평선을 마주할 수 있는 용담이호해안도로이며 제주공항과 가까운 곳에 있어 여행 전후로 가볍게 드라이브를 즐길 수 있는 곳입니다.,0
청풍호관광모노레일,4.1," 1,718",관광 명소,"114, 도곡리 청풍면 제천시 충청북도","왕복 50분이 소요되고 가파른 구간도 일부 있는 현대적인 모노레일 코스로 호수, 산, 숲의 풍경을 볼 수 있습니다.",4
168계단,4.2," 1,768",관광 명소,부산광역시 동구 영초길 191,"168개 계단으로 이루어진 가파르고 좁은 오르막길로, 모노레일이 운행됩니다.",4
목포 갓바위,4.2," 1,540",관광 명소,전라남도 목포시 용해동 산86-24,다리에서 보면 삿갓을 쓴 두 남자의 모습을 닮은 사암 바위입니다.,4
용머리해안,4.4," 4,215",관광 명소,제주특별자치도 서귀포시 안덕면 사계리,바위가 많은 이 해안은 산책하기 좋고 독특한 절벽과 아름다운 바다 경관을 자랑합니다.,0
낙산공원,4.5," 4,729",공원,서울특별시 종로구 이화동 낙산길 41,"산책로가 있는 언덕 위의 녹지 공간으로, 밤낮의 서울 전경을 감상할 수 있는 전망대가 몇 개 있습니다.",0
만천하스카이워크,4.3," 1,882",전망대,충청북도 단양군 적성면 애곡리 5,"유리 바닥으로 된 언덕 위 스카이워크로, 하곡 방향을 향해 있으며 탁 트인 산의 풍경과 집라인을 즐길 수 있습니다.",3
청풍문화재단지,4.2," 1,513",관광 명소,충청북도 제천시 청풍면 청풍호로 2048,1985년 댐 건설로 수몰된 수 세기 역사 마을의 유물을 이전하여 복원해 놓은 단지입니다.,4
춘향테마파크,3.7," 1,062",관광 명소,전라북도 남원시 노암동 양림길 14-9,춘향전을 주제로 조성한 관광지로 광한루원 건너편에 위치한 남원관광지에 자리하고 있으며 임권택 감독의 '춘향뎐'과 2005년의 KBS드라마 '쾌걸춘향'의 촬영지이기도 합니다.,5
진주성,4.5," 3,185",관광 명소,경상남도 진주시 성지동 남강로 626,"중세 시대 요새로 1,760m 길이의 바위벽으로 둘러싸여 있으며 정교한 정자와 역사박물관이 있습니다.",0
반포한강공원,4.4," 6,042",공원,서울특별시 서초구 반포2동 신반포로11길 40,강을 따라 걷고 뛰며 자전거를 탈 수 있는 편안한 분위기의 공원으로 시장과 피크닉 공간도 있습니다.,0
물의정원,4.3," 3,532",생태 공원,경기도 남양주시 조안면 북한강로 398, 국토교통부가 2012년 한강 살리기 사업으로 조성한 484188㎡의 광대한 면적의 수변생태공원으로 조성되었습니다.,1
한림공원,4.3," 4,556",식물원,제주특별자치도 제주시 한림읍 한림로 300,"다양한 아름다운 정원, 2개의 동굴, 작은 동물원, 민속촌이 있는 인기 관광지입니다.",1
흰여울마을,4.3," 4,815",관광 명소,부산광역시 영도구 영선동4가 1043,"재개발된 예술적인 문화 마을로 좁은 골목, 거리 벽화, 해안 산책로가 있습니다.",4
제주절물자연휴양림,4.6," 5,294",휴양림,제주특별자치도 제주시 봉개동 명림로 584,"이 고요한 공원에는 삼나무 숲 등산로, 화산으로 생성된 언덕, 피크닉 테이블, 놀이터가 있습니다.",3
천제연폭포,4.3," 4,288",관광 명소,제주특별자치도 서귀포시 중문동 2232,동굴에서 쏟아지는 물이 3단계의 폭포를 이루고 녹지로 둘러싸여 있습니다.,4
한라수목원,4.3," 4,238",수목원,제주특별자치도 제주시 연동 수목원길 72,"1,100개가 넘는 종류의 현지 및 아열대 식물과 아름다운 산책로가 있는 녹음이 우거진 수목원입니다",1
1913 송정역시장,3.9," 4,043",관광 명소,광주광역시 광산구 송정동 송정로16번길 38,"트렌디한 인디 상점과 튀김, 라면, 떡 등을 파는 식당이 있는 오랜 역사의 시장입니다.",5
부산타워,4.2," 5,947",관광 명소,부산광역시 중구 광복동2가 용두산길 37-30,전망대와 카페가 있는 118m 높이의 타워 꼭대기에서 멋진 전경을 볼 수 있습니다.,4
메타세콰이아가로수길,4.1," 4,819",관광 명소,전라남도 담양군 담양읍 메타세쿼이아로 12,전국 제일의 가로수길로 숲이 만들어 놓은 터널처럼 여름에는 시원한 청량감을 주며 가을이면 갈색낙엽과 굵직한 가로수 도열이 마치 동화속 병정들의 열병식을 보는 듯한 착각에 빠지게합니다.,4
모래시계공원,4.0," 4,741",공원,강원도 강릉시 강동면 정동진리 산2,모래시계공원은 동해 바다와 산 정동진 2리 마을을 배경으로 아담하게 꾸며져 있습니다.,5
삼청동길,4.2," 1,615",관광 명소,서울특별시 종로구 삼청동,"전통 한옥과 현대적인 부티크, 식당 등이 어우러져 있는 거리입니다.",4
반포대교 달빛무지개분수,4.5," 2,343",관광 명소,서울특별시 서초구 반포2동,"대교를 따라 조성된 1,140m 길이 분수로 봄과 여름에는 정해진 시간마다 화려한 조명의 분수 쇼를 볼 수 있습니다.",0
평화의공원,4.5," 1,512",공원,서울특별시 마포구 상암동 월드컵로 243-60,평화의공원은 월드컵공원 전체를 대표하는 공원이며 월드컵경기장과 강북강변로 사이의 평지 약 44만㎡의 규모로 조성되어 있습니다.,0
경춘선숲길,4.5," 1,030",공원,서울특별시 노원구 월계2동 276-40,복선화 공사로 폐선로로 방치되어오던 철길이 서울시의 도시재생사업으로 태어난 특별한 공원입니다.,0
서울함공원,4.2," 1,472",공원,서울특별시 마포구 망원1동 마포나루길 407,대한민국 3면의 바다를 지켜온 서울함(호위함)과 참수리 고속정과 돌고래급 잠수함 등이 전시된 공원입니다.,4
절두산 순교성지,4.5," 1,424",종교적 성지,서울특별시 마포구 합정동 토정로 6,"1866년 병인양요 당시 처형된 가톨릭 신자를 위한 사원, 교회, 박물관이 있습니다.",3
월드컵공원,4.5," 1,496",공원,서울특별시 마포구 상암동 월드컵로 243-60,"매립지 위에 건설한 드넓은 공원으로 강, 연못, 정원, 전망대가 있습니다.",0
의왕레일바이크,4.2," 1,019",테마파크,경기도 의왕시 월암동 525-9,100만여㎡에 이르는 왕송호수 주변을 따라 레일바이크를 타고 30분~1시간 정도 호수의 전경과 철새 습지 등의 자연경관을 체험할 수 있도록 꾸며졌습니다.,2
북한산 백운대,4.8," 2,296",국립공원,경기도 고양시 덕양구 북한동,가장 널리 알려진 일반적인 북한산 등산코스로 우이동에서 백운대 정상까지 2.1km로 가장 짧습니다.,0
달전망대,4.2," 4,607",전망대,경기도 안산시 단원구 대부동 대부황금로 1927,시화호와 서해를 조망할 수 있는 시화지역의 랜드마크입니다.,2
DDP 동대문디자인플라자,4.3," 24,343",문화센터,서울특별시 중구 을지로7가 을지로 281,미래형 디자인이 돋보이는 건축학적 명소로 디자인 마켓과 음식점이 있으며 다양한 행사가 열립니다.,1
용두암,3.9," 13,622",관광 명소,제주특별자치도 제주시 용담2동 용두암길 15,해안에 위치한 용 머리 모양의 화산암 형성물이 있는 인기 명소입니다.,5
전주 한옥마을,4.1," 24,730",관광 명소,전라북도 전주시 완산구 풍남동3가 기린대로 99,"전통 한옥, 서예 박물관, 전통술 박물관이 있는 문화 마을입니다.",4
북촌한옥마을,4.3," 12,851",문화 유산 보존,서울특별시 종로구 계동 계동길 37,14세기를 재현해 놓은 마을로 좁은 골목을 따라 전통 가옥이 즐비해 있습니다.,1
홍대쇼핑거리,4.3," 7,460",상업 지구,서울특별시 마포구 서교동 365-8,청춘들의 아지트 홍대 거리에는 패션과 뷰티등이 즐비한 거리입니다.,1
덕수궁,4.5," 15,392",고궁,서울특별시 중구 세종대로 99,서울의 심장부에 있는 유서 깊은 궁전으로 왕궁수문장 교대 의식을 볼 수 있습니다.,0
인사동거리,4.2," 10,589",관광 명소,서울특별시 종로구 인사동,가장 많은 외국인 관광객이 찾는 거리이며 스타벅스의 간판마저 한글로 바꿔버릴 만큼 그 전통이 깊숙이 뿌리 내린 동네이기도 합니다.,4
쇠소깍,4.2," 11,598",관광 명소,제주특별자치도 서귀포시 쇠소깍로 138,한라산에서 흘러내려 온 물줄기가 제주도 남쪽으로 흐른다는 효돈천의 끝자락에 위치하고 있습니다.,4
경복궁,4.6," 34,928",고궁,서울특별시 종로구 사직로 161,박물관과 정원이 있는 거대한 14세기 왕궁이며 무료 가이드 투어가 제공됩니다.,0
정방폭포,4.5," 8,544",관광 명소,제주특별자치도 서귀포시 칠십리로214번길 37,폭포수가 절벽에서 바다로 떨어지는 계단식 해안폭포이며 높이가 75피트에 달합니다.,0
안동 하회마을,4.1," 5,869",관광 명소,경상북도 안동시 풍천면 전서로 186,조선의 전통 탈 제작 및 기타 공예품으로 유명한 조선 시대 마을입니다.,4
도담삼봉,4.1," 7,584",관광 명소,충청북도 단양군 매포읍 삼봉로 644-13,"들쭉날쭉한 암석 3개가 강물 위로 우뚝 솟아있는 명소로, 분수 쇼와 스피드보트를 즐길 수 있습니다.",4
